<?xml version="1.0" encoding="UTF-8"?>
<Gestion xmlns:xsi="http://www.w3.org/2001/XMLSchema-instance"
        xsi:noNamespaceSchemaLocation="parcelle.xsd">

<!--
Un seul élément Parcelles et un seul éléments Gestionnaires
-->
<!-- Les éléments Parcelles et Gestionnaires peuvent être dans n'importe quel ordre
-->
<Parcelles>
	<!--un ensemble non vide d'éléments Parcelle --><!--l'attribut numParcelle est une clé -->
	<!--L'utilisation de ID n'est pas acceptée -->
	<Parcelle numParcelle="P1">
		<!--
		un élément Section, un élément Superficie, un élément Gestionnaire 
		-->
		<section>parcelleSud</section>
		<superficie>1250m2</superficie>
		<!-- l'élément Gestionnaire est une référence vers l'attribut idGestionnaire de l'élément Gestionnaire -->
		<!--L'utilisation de IDREF n'est pas acceptée -->
		<Gestionnaire>G1</Gestionnaire>
		<!-- Zéro ou un élément Activites-->
		<Activites>
			<!-- Zéro ou plusieurs éléments ActAgricole-->
			<!--
			 La valeur de l'attribut type doit être soit Récolte ou Anti-insectes 
			-->
			<ActAgricole type="Récolte" cout="2500">
				<!--un ensemble non vide d'éléments Semaine -->
				<Semaine> 3 </Semaine>
				<Semaine> 5 </Semaine>
			</ActAgricole>
			<!-- Zéro ou plusieurs éléments ActTraitement
			L'élément ActTraitement est une extension de ActAgricole 
			-->
			<ActTraitement type="Anti-Insectes" cout="1800" typeInsectes="Ver">
				<Semaine> 2 </Semaine>
				<Semaine> 6 </Semaine>
			</ActTraitement>
		</Activites>
	</Parcelle>
</Parcelles>
<Gestionnaires>
	<!--un ensemble non vide d'éléments Gestionnaire 
	idGestionnaire est une clé-->
	<Gestionnaire idGestionnaire="G1">
		<nom>Godart</nom>
		<prenom>Jean</prenom>
		<adresse>Toulouse</adresse>
	</Gestionnaire>
</Gestionnaires>
</Gestion>
